{
  "provider": "GitHub Actions",
  "ci_run_id": "36905605691",
  "commit_sha": "6dc957c1a2f936d55a191e06a8003ff1af218c6f",
  "job_name": "all-required-selected-jobs",
  "result": "FAIL",
  "failed_checks": [
    "gate:completed/failure",
    "mobile:completed/failure"
  ],
  "duration_ms": 376000.0,
  "evidence_reference": "https://github.com/nilesthump/IM-platform/actions/runs/36905605691"
}
